<?xml version='1.0' encoding='UTF-8' ?>
<!DOCTYPE dataset SYSTEM "./src/test/resources/dtd/topaze.dtd">
<dataset>
<bonpreparation/>
<bonpreparation id="1" reference="REF_BP_GLOBAL" dateInitiation="[now-7days]" datePreparation="[now]" idClient="ID_CLIENT" typeBonPreparation="LIVRAISON" />
<bonpreparation id="5" reference="REF_BP_GLOBAL_A_PREPARER" dateInitiation="[now-7days]" idClient="ID_CLIENT" typeBonPreparation="MIGRATION"/>

<elementlivraison id="2" reference="REF_SBP1" addresseLivraison="ADR_LIV" bonPreparationParent="1" retailerPackagerId="CODE_PRODUIT" dateInitiation="[now-7days]" datePreparation="[now]"  dateLivraisonTermine="[now]"  acteur="NETDELIVERY" referenceProduit="REF_PRODUIT" typeBonPreparation="LIVRAISON" />
<elementlivraison id="3" reference="REF_SBP2" addresseLivraison="ADR_LIV" bonPreparationParent="1" retailerPackagerId="CODE_PRODUIT" dateInitiation="[now-7days]" datePreparation="[now]" dateLivraisonTermine="[now]" acteur="NETDELIVERY" referenceProduit="REF_PRODUIT" typeBonPreparation="LIVRAISON" />
<elementlivraison id="4" reference="REF_SBP3" addresseLivraison="ADR_LIV" bonPreparationParent="1" retailerPackagerId="CODE_PRODUIT" dateInitiation="[now-7days]" datePreparation="[now]" dateLivraisonTermine="[now]" acteur="PACKAGER" referenceProduit="REF_PRODUIT_TEMPLATE" typeBonPreparation="LIVRAISON" />

<elementlivraison id="6" reference="REF_SBP1" addresseLivraison="ADR_LIV" bonPreparationParent="5" retailerPackagerId="CODE_PRODUIT_1" dateInitiation="[now-7days]" dateLivraisonTermine="[now+7days]"  acteur="NETDELIVERY" referenceProduit="REF_PRODUIT" typeBonPreparation="MIGRATION" />
<elementlivraison id="7" reference="REF_SBP1" addresseLivraison="ADR_LIV" bonPreparationParent="5" retailerPackagerId="CODE_PRODUIT" dateInitiation="[now-7days]" dateLivraisonTermine="[now]"   acteur="NETDELIVERY" referenceProduit="REF_PRODUIT" typeBonPreparation="LIVRAISON" />
<elementlivraison id="8" reference="REF_SBP1" addresseLivraison="ADR_LIV" bonPreparationParent="5" retailerPackagerId="CODE_PRODUIT" dateInitiation="[now-7days]" dateLivraisonTermine="[now]"   acteur="PACKAGER" referenceProduit="REF_PRODUIT_TEMPLATE" typeBonPreparation="LIVRAISON" />
</dataset>
